{
  "$schema": "https://json-schema.org/draft/2020-12/schema",
  "$id": "https://example.org/schemas/action_bundle.schema.json",
  "title": "ActionBundle",
  "type": "object",
  "required": [
    "bundle_id",
    "target",
    "tool",
    "parameters",
    "confidence_scores",
    "scope_tags",
    "time_bound",
    "evidence_plan"
  ],
  "properties": {
    "bundle_id": {
      "type": "string"
    },
    "target": {
      "type": "string",
      "description": "CIDR, FQDN, host identifier, or other target reference."
    },
    "tool": {
      "type": "string"
    },
    "tool_class": {
      "type": "string",
      "enum": [
        "RECON",
        "SCAN",
        "ANALYSIS",
        "SIMULATION",
        "OTHER"
      ],
      "default": "OTHER"
    },
    "parameters": {
      "type": "object"
    },
    "confidence_scores": {
      "type": "object",
      "additionalProperties": false,
      "required": [
        "objective_clarity",
        "tool_specificity",
        "constraint_completeness",
        "risk_assessment_depth",
        "precedent_availability",
        "composite"
      ],
      "properties": {
        "objective_clarity": {
          "type": "number",
          "minimum": 0.0,
          "maximum": 1.0
        },
        "tool_specificity": {
          "type": "number",
          "minimum": 0.0,
          "maximum": 1.0
        },
        "constraint_completeness": {
          "type": "number",
          "minimum": 0.0,
          "maximum": 1.0
        },
        "risk_assessment_depth": {
          "type": "number",
          "minimum": 0.0,
          "maximum": 1.0
        },
        "precedent_availability": {
          "type": "number",
          "minimum": 0.0,
          "maximum": 1.0
        },
        "composite": {
          "type": "number",
          "minimum": 0.0,
          "maximum": 1.0
        }
      }
    },
    "scope_tags": {
      "type": "array",
      "items": {
        "type": "string"
      }
    },
    "time_bound": {
      "type": "string",
      "description": "ISO 8601 timestamp or date-time bound."
    },
    "prerequisites_satisfied": {
      "type": "array",
      "items": {
        "type": "string"
      },
      "description": "Prerequisite checks satisfied for this action; consumed by PREREQUISITE policy rules."
    },
    "irreversibility_class": {
      "type": "string",
      "enum": ["reversible", "partial", "irreversible"],
      "default": "reversible",
      "description": "Reversibility of the action; consumed by the confidence cap (R6)."
    },
    "cross_cell_scope": {
      "type": "boolean",
      "default": false,
      "description": "Whether the action's effects span multiple Grid Cells."
    },
    "rollback_plan": {
      "type": ["object", "boolean"],
      "description": "Presence indicates an attached rollback/contingency plan (confidence cap)."
    },
    "impact_assessment": {
      "type": ["object", "boolean"],
      "description": "Presence indicates an attached impact assessment (confidence cap)."
    },
    "data_handling": {
      "type": "string",
      "enum": [
        "PUBLIC",
        "INTERNAL",
        "SENSITIVE"
      ],
      "default": "INTERNAL"
    },
    "expected_results": {
      "type": "object"
    },
    "notes": {
      "type": "string"
    },
    "evidence_plan": {
      "type": "object",
      "required": [
        "evidence_level"
      ],
      "properties": {
        "evidence_level": {
          "type": "string",
          "enum": [
            "NONE",
            "BASIC",
            "FULL"
          ],
          "default": "BASIC"
        },
        "artifacts": {
          "type": "array",
          "items": {
            "type": "string"
          }
        }
      },
      "additionalProperties": true
    }
  },
  "additionalProperties": false
}
