{
  "bundle_id": "CI-ALLOW-001",
  "target": "SUB-47-BKR-001",
  "tool": "open_breaker",
  "tool_class": "OTHER",
  "parameters": {
    "action": "open",
    "equipment_id": "SUB-47-BKR-001",
    "maintenance_phase": "isolation",
    "upstream_isolation_verified": true,
    "downstream_load_transferred": true,
    "work_permit_active": true,
    "restoration_procedure_confirmed": true,
    "backup_feed_status": "available"
  },
  "confidence_scores": {
    "objective_clarity": 0.95,
    "tool_specificity": 0.95,
    "constraint_completeness": 0.98,
    "risk_assessment_depth": 0.90,
    "precedent_availability": 0.97,
    "composite": 0.95
  },
  "scope_tags": [
    "maintenance_window",
    "SUB-47",
    "scheduled_switching"
  ],
  "time_bound": "2026-04-07T06:00:00Z",
  "data_handling": "INTERNAL",
  "evidence_plan": {
    "evidence_level": "FULL",
    "artifacts": [
      "switching_order_SUB47_20260407",
      "isolation_verification_log",
      "work_permit_WP-2026-0407-001"
    ]
  },
  "notes": "Routine scheduled breaker opening within maintenance window. All prerequisites verified: upstream isolation confirmed, downstream load transferred to backup feed, work permit WP-2026-0407-001 active."
}
